signed_label,goal_number,view_description,signatures_number,nodepetition_link/_text,nodepetition_link,signatures_number/_source,view_label,goal_number/_source,nodepetition_link/_source,goal_label,pageUrl,fielditem_value
signed,100000,pay close attention on The Nagorno-Karabakh conflict. 20% of Azerbaijan territory was occupied by Armenian military.,105686,pay close attention on The Nagorno-Karabakh conflict. 20% of Azerbaijan territory was occupied by Armenian military.,https://petitions.whitehouse.gov/petition/pay-close-attention-nagorno-karabakh-conflict-20-azerbaijan-territory-was-occupied-armenian,"105,686",View,"100,000",/petition/pay-close-attention-nagorno-karabakh-conflict-20-azerbaijan-territory-was-occupied-armenian,goal,https://petitions.whitehouse.gov/responses?page=6,Foreign Policy
signed,100000,"issue a proclamation commemorating and recognizing the war crime of the Khojaly Massacre, and its victims",126828,"issue a proclamation commemorating and recognizing the war crime of the Khojaly Massacre, and its victims",https://petitions.whitehouse.gov/petition/issue-proclamation-commemorating-and-recognizing-war-crime-khojaly-massacre-and-its-victims,"126,828",View,"100,000",/petition/issue-proclamation-commemorating-and-recognizing-war-crime-khojaly-massacre-and-its-victims,goal,https://petitions.whitehouse.gov/responses?page=6,Foreign Policy
signed,25000,Establish Lunar New Year as a National Holiday. Give it the same importance and weight as the other cultural holidays.,39780,Establish Lunar New Year as a National Holiday. Give it the same importance and weight as the other cultural holidays.,https://petitions.whitehouse.gov/petition/establish-lunar-new-year-national-holiday-give-it-same-importance-and-weight-other-cultural,"39,780",View,"25,000",/petition/establish-lunar-new-year-national-holiday-give-it-same-importance-and-weight-other-cultural,goal,https://petitions.whitehouse.gov/responses?page=6,Education
signed,25000,Use the State of the Union to call for a constitutional amendment to get big money out of politics.,39168,Use the State of the Union to call for a constitutional amendment to get big money out of politics.,https://petitions.whitehouse.gov/petition/use-state-union-call-constitutional-amendment-get-big-money-out-politics,"39,168",View,"25,000",/petition/use-state-union-call-constitutional-amendment-get-big-money-out-politics,goal,https://petitions.whitehouse.gov/responses?page=6,
signed,25000,Place the DC “Taxation Without Representation” License Plate on the Presidential Limousine.,3735,Place the DC “Taxation Without Representation” License Plate on the Presidential Limousine.,https://petitions.whitehouse.gov/petition/place-dc-%E2%80%9Ctaxation-without-representation%E2%80%9D-license-plate-presidential-limousine,"3,735",View,"25,000",/petition/place-dc-%E2%80%9Ctaxation-without-representation%E2%80%9D-license-plate-presidential-limousine,goal,https://petitions.whitehouse.gov/responses?page=6,
signed,25000,Require free access over the Internet to scientific journal articles arising from taxpayer-funded research.,65704,Require free access over the Internet to scientific journal articles arising from taxpayer-funded research.,https://petitions.whitehouse.gov/petition/require-free-access-over-internet-scientific-journal-articles-arising-taxpayer-funded,"65,704",View,"25,000",/petition/require-free-access-over-internet-scientific-journal-articles-arising-taxpayer-funded,goal,https://petitions.whitehouse.gov/responses?page=6,Education
signed,25000,Make all involved in the rape of the Steubenville scandal be pushed out of Juvenile court so there can be real justice.,31421,Make all involved in the rape of the Steubenville scandal be pushed out of Juvenile court so there can be real justice.,https://petitions.whitehouse.gov/petition/make-all-involved-rape-steubenville-scandal-be-pushed-out-juvenile-court-so-there-can-be,"31,421",View,"25,000",/petition/make-all-involved-rape-steubenville-scandal-be-pushed-out-juvenile-court-so-there-can-be,goal,https://petitions.whitehouse.gov/responses?page=6,
signed,25000,Support the People of Catalonia in their effort to decide their own future,33070,Support the People of Catalonia in their effort to decide their own future,https://petitions.whitehouse.gov/petition/support-people-catalonia-their-effort-decide-their-own-future,"33,070",View,"25,000",/petition/support-people-catalonia-their-effort-decide-their-own-future,goal,https://petitions.whitehouse.gov/responses?page=6,Foreign Policy
signed,25000,outlaw offending prophets of major religions,38023,outlaw offending prophets of major religions,https://petitions.whitehouse.gov/petition/outlaw-offending-prophets-major-religions,"38,023",View,"25,000",/petition/outlaw-offending-prophets-major-religions,goal,https://petitions.whitehouse.gov/responses?page=6,
signed,25000,We request that Obama be impeached for the following reasons.,49890,We request that Obama be impeached for the following reasons.,https://petitions.whitehouse.gov/petition/we-request-obama-be-impeached-following-reasons,"49,890",View,"25,000",/petition/we-request-obama-be-impeached-following-reasons,goal,https://petitions.whitehouse.gov/responses?page=6,
signed,25000,Cease paychecks and health benefits to ALL members of Congress and the President until the fiscal cliff is avoided,30166,Cease paychecks and health benefits to ALL members of Congress and the President until the fiscal cliff is avoided,https://petitions.whitehouse.gov/petition/cease-paychecks-and-health-benefits-all-members-congress-and-president-until-fiscal-cliff,"30,166",View,"25,000",/petition/cease-paychecks-and-health-benefits-all-members-congress-and-president-until-fiscal-cliff,goal,https://petitions.whitehouse.gov/responses?page=6,
signed,25000,Peacefully grant the State of Tennessee to withdraw from the United States of America and create its own NEW government.,32694,Peacefully grant the State of Tennessee to withdraw from the United States of America and create its own NEW government.,https://petitions.whitehouse.gov/petition/peacefully-grant-state-tennessee-withdraw-united-states-america-and-create-its-own-new-3,"32,694",View,"25,000",/petition/peacefully-grant-state-tennessee-withdraw-united-states-america-and-create-its-own-new-3,goal,https://petitions.whitehouse.gov/responses?page=6,
signed,25000,Peacefully grant the State of Louisiana to withdraw from the United States of America and create its own NEW government.,38991,Peacefully grant the State of Louisiana to withdraw from the United States of America and create its own NEW government.,https://petitions.whitehouse.gov/petition/peacefully-grant-state-louisiana-withdraw-united-states-america-and-create-its-own-new,"38,991",View,"25,000",/petition/peacefully-grant-state-louisiana-withdraw-united-states-america-and-create-its-own-new,goal,https://petitions.whitehouse.gov/responses?page=6,
signed,25000,Deport Everyone That Signed A Petition To Withdraw Their State From The United States Of America.,29650,Deport Everyone That Signed A Petition To Withdraw Their State From The United States Of America.,https://petitions.whitehouse.gov/petition/deport-everyone-signed-petition-withdraw-their-state-united-states-america,"29,650",View,"25,000",/petition/deport-everyone-signed-petition-withdraw-their-state-united-states-america,goal,https://petitions.whitehouse.gov/responses?page=6,
signed,25000,Peacefully grant the State of Alabama to withdraw from the United States of America and create its own NEW government.,31597,Peacefully grant the State of Alabama to withdraw from the United States of America and create its own NEW government.,https://petitions.whitehouse.gov/petition/peacefully-grant-state-alabama-withdraw-united-states-america-and-create-its-own-new,"31,597",View,"25,000",/petition/peacefully-grant-state-alabama-withdraw-united-states-america-and-create-its-own-new,goal,https://petitions.whitehouse.gov/responses?page=7,
signed,25000,Peacefully grant the State of North Carolina to withdraw from the United States and create its own NEW government,31835,Peacefully grant the State of North Carolina to withdraw from the United States and create its own NEW government,https://petitions.whitehouse.gov/petition/peacefully-grant-state-north-carolina-withdraw-united-states-and-create-its-own-new,"31,835",View,"25,000",/petition/peacefully-grant-state-north-carolina-withdraw-united-states-and-create-its-own-new,goal,https://petitions.whitehouse.gov/responses?page=7,
signed,25000,Peacefully grant the State of Florida to withdraw from the United States of America and create its own NEW government.,37014,Peacefully grant the State of Florida to withdraw from the United States of America and create its own NEW government.,https://petitions.whitehouse.gov/petition/peacefully-grant-state-florida-withdraw-united-states-america-and-create-its-own-new-2,"37,014",View,"25,000",/petition/peacefully-grant-state-florida-withdraw-united-states-america-and-create-its-own-new-2,goal,https://petitions.whitehouse.gov/responses?page=7,
signed,25000,Peacefully grant the State of S.C. to withdraw from the United States of America and create its own NEW government.,26104,Peacefully grant the State of S.C. to withdraw from the United States of America and create its own NEW government.,https://petitions.whitehouse.gov/petition/peacefully-grant-state-sc-withdraw-united-states-america-and-create-its-own-new-government,"26,104",View,"25,000",/petition/peacefully-grant-state-sc-withdraw-united-states-america-and-create-its-own-new-government,goal,https://petitions.whitehouse.gov/responses?page=7,
signed,25000,Peacefully grant the State of Georgia to withdraw from the United States of America and create its own NEW government.,33828,Peacefully grant the State of Georgia to withdraw from the United States of America and create its own NEW government.,https://petitions.whitehouse.gov/petition/peacefully-grant-state-georgia-withdraw-united-states-america-and-create-its-own-new-1,"33,828",View,"25,000",/petition/peacefully-grant-state-georgia-withdraw-united-states-america-and-create-its-own-new-1,goal,https://petitions.whitehouse.gov/responses?page=7,
signed,25000,Peacefully grant the State of Tennessee to withdraw from the United States of America and create its own NEW government.,32694,Peacefully grant the State of Tennessee to withdraw from the United States of America and create its own NEW government.,https://petitions.whitehouse.gov/petition/peacefully-grant-state-tennessee-withdraw-united-states-america-and-create-its-own-new-3,"32,694",View,"25,000",/petition/peacefully-grant-state-tennessee-withdraw-united-states-america-and-create-its-own-new-3,goal,https://petitions.whitehouse.gov/responses?page=7,
signed,25000,Help bring Jon Hammar home.,27248,Help bring Jon Hammar home.,https://petitions.whitehouse.gov/petition/help-bring-jon-hammar-home,"27,248",View,"25,000",/petition/help-bring-jon-hammar-home,goal,https://petitions.whitehouse.gov/responses?page=7,
signed,25000,"Secure resources and funding, and begin construction of a Death Star by 2016.",34435,"Secure resources and funding, and begin construction of a Death Star by 2016.",https://petitions.whitehouse.gov/petition/secure-resources-and-funding-and-begin-construction-death-star-2016,"34,435",View,"25,000",/petition/secure-resources-and-funding-and-begin-construction-death-star-2016,goal,https://petitions.whitehouse.gov/responses?page=7,
signed,25000,Deport British Citizen Piers Morgan for Attacking 2nd Amendment,109334,Deport British Citizen Piers Morgan for Attacking 2nd Amendment,https://petitions.whitehouse.gov/petition/deport-british-citizen-piers-morgan-attacking-2nd-amendment,"109,334",View,"25,000",/petition/deport-british-citizen-piers-morgan-attacking-2nd-amendment,goal,https://petitions.whitehouse.gov/responses?page=7,Immigration
signed,25000,"Support a law protecting states' rights to legalize, regulate and tax marijuana like alcohol.",46185,"Support a law protecting states' rights to legalize, regulate and tax marijuana like alcohol.",https://petitions.whitehouse.gov/petition/support-law-protecting-states-rights-legalize-regulate-and-tax-marijuana-alcohol,"46,185",View,"25,000",/petition/support-law-protecting-states-rights-legalize-regulate-and-tax-marijuana-alcohol,goal,https://petitions.whitehouse.gov/responses?page=7,
signed,25000,Remove marijuana from the federal Controlled Substance Act and allow the states to decide how they want to regulate it.,83684,Remove marijuana from the federal Controlled Substance Act and allow the states to decide how they want to regulate it.,https://petitions.whitehouse.gov/petition/remove-marijuana-federal-controlled-substance-act-and-allow-states-decide-how-they-want,"83,684",View,"25,000",/petition/remove-marijuana-federal-controlled-substance-act-and-allow-states-decide-how-they-want,goal,https://petitions.whitehouse.gov/responses?page=7,
signed,25000,Federally Legalize Marijuana,44049,Federally Legalize Marijuana,https://petitions.whitehouse.gov/petition/federally-legalize-marijuana,"44,049",View,"25,000",/petition/federally-legalize-marijuana,goal,https://petitions.whitehouse.gov/responses?page=7,
signed,25000,"Grant a full pardon to Chris Williams, a man facing 80 years in prison for legally growing Medical Marijuana",29536,"Grant a full pardon to Chris Williams, a man facing 80 years in prison for legally growing Medical Marijuana",https://petitions.whitehouse.gov/petition/grant-full-pardon-chris-williams-man-facing-80-years-prison-legally-growing-medical,"29,536",View,"25,000",/petition/grant-full-pardon-chris-williams-man-facing-80-years-prison-legally-growing-medical,goal,https://petitions.whitehouse.gov/responses?page=7,
signed,25000,Light the White House Purple to Celebrate 75th Anniversary of March of Dimes and as Symbol of Hope to Preemie Families,26653,Light the White House Purple to Celebrate 75th Anniversary of March of Dimes and as Symbol of Hope to Preemie Families,https://petitions.whitehouse.gov/petition/light-white-house-purple-celebrate-75th-anniversary-march-dimes-and-symbol-hope-preemie,"26,653",View,"25,000",/petition/light-white-house-purple-celebrate-75th-anniversary-march-dimes-and-symbol-hope-preemie,goal,https://petitions.whitehouse.gov/responses?page=7,Health Care
signed,25000,"Identify Russian law-makers jeopardizing lives of Russian orphans responsible under ""Magnitsky Act"".",54509,"Identify Russian law-makers jeopardizing lives of Russian orphans responsible under ""Magnitsky Act"".",https://petitions.whitehouse.gov/petition/identify-russian-law-makers-jeopardizing-lives-russian-orphans-responsible-under-magnitsky,"54,509",View,"25,000",/petition/identify-russian-law-makers-jeopardizing-lives-russian-orphans-responsible-under-magnitsky,goal,https://petitions.whitehouse.gov/responses?page=7,Foreign Policy
signed,25000,"Recognize Dima Yakovlev Law (186614-6) as harmful and inhumane, extend Magnitsky act to its supporters in Russian Duma.",8498,"Recognize Dima Yakovlev Law (186614-6) as harmful and inhumane, extend Magnitsky act to its supporters in Russian Duma.",https://petitions.whitehouse.gov/petition/recognize-dima-yakovlev-law-186614-6-harmful-and-inhumane-extend-magnitsky-act-its,"8,498",View,"25,000",/petition/recognize-dima-yakovlev-law-186614-6-harmful-and-inhumane-extend-magnitsky-act-its,goal,https://petitions.whitehouse.gov/responses?page=7,Foreign Policy
signed,25000,"add Mr. Putin to Magnitsky list if he will support ""anti-Magnitsky Act""",12171,"add Mr. Putin to Magnitsky list if he will support ""anti-Magnitsky Act""",https://petitions.whitehouse.gov/petition/add-mr-putin-magnitsky-list-if-he-will-support-anti-magnitsky-act,"12,171",View,"25,000",/petition/add-mr-putin-magnitsky-list-if-he-will-support-anti-magnitsky-act,goal,https://petitions.whitehouse.gov/responses?page=7,
signed,25000,"give federal employees a day off on Monday, December 24, 2012 (Christmas Eve).",28257,"give federal employees a day off on Monday, December 24, 2012 (Christmas Eve).",https://petitions.whitehouse.gov/petition/give-federal-employees-day-monday-december-24-2012-christmas-eve,"28,257",View,"25,000",/petition/give-federal-employees-day-monday-december-24-2012-christmas-eve,goal,https://petitions.whitehouse.gov/responses?page=7,
signed,25000,Have armed security at all schools across the nation who are ex military from combat MOSs or combat proven.,4374,Have armed security at all schools across the nation who are ex military from combat MOSs or combat proven.,https://petitions.whitehouse.gov/petition/have-armed-security-all-schools-across-nation-who-are-ex-military-combat-moss-or-combat,"4,374",View,"25,000",/petition/have-armed-security-all-schools-across-nation-who-are-ex-military-combat-moss-or-combat,goal,https://petitions.whitehouse.gov/responses?page=7,Education
signed,25000,Establish federal gun control laws,6663,Establish federal gun control laws,https://petitions.whitehouse.gov/petition/establish-federal-gun-control-laws,"6,663",View,"25,000",/petition/establish-federal-gun-control-laws,goal,https://petitions.whitehouse.gov/responses?page=7,
signed,25000,No more gun control.,3519,No more gun control.,https://petitions.whitehouse.gov/petition/no-more-gun-control,"3,519",View,"25,000",/petition/no-more-gun-control,goal,https://petitions.whitehouse.gov/responses?page=8,
signed,25000,Stop Demonizing Guns,1270,Stop Demonizing Guns,https://petitions.whitehouse.gov/petition/stop-demonizing-guns,"1,270",View,"25,000",/petition/stop-demonizing-guns,goal,https://petitions.whitehouse.gov/responses?page=8,
signed,25000,"Not punish the tens of millions of law-abiding gun owners with ineffective and unconstitutional ""assault weapons"" bans.",8652,"Not punish the tens of millions of law-abiding gun owners with ineffective and unconstitutional ""assault weapons"" bans.",https://petitions.whitehouse.gov/petition/not-punish-tens-millions-law-abiding-gun-owners-ineffective-and-unconstitutional-assault,"8,652",View,"25,000",/petition/not-punish-tens-millions-law-abiding-gun-owners-ineffective-and-unconstitutional-assault,goal,https://petitions.whitehouse.gov/responses?page=8,
signed,25000,Immediately sign Executive Order banning sale of assault weapons and high-capacity magazines until Congress acts on this,3755,Immediately sign Executive Order banning sale of assault weapons and high-capacity magazines until Congress acts on this,https://petitions.whitehouse.gov/petition/immediately-sign-executive-order-banning-sale-assault-weapons-and-high-capacity-magazines,"3,755",View,"25,000",/petition/immediately-sign-executive-order-banning-sale-assault-weapons-and-high-capacity-magazines,goal,https://petitions.whitehouse.gov/responses?page=8,
signed,25000,Start the process to enact Federal Gun control reforms.,10452,Start the process to enact Federal Gun control reforms.,https://petitions.whitehouse.gov/petition/start-process-enact-federal-gun-control-reforms,"10,452",View,"25,000",/petition/start-process-enact-federal-gun-control-reforms,goal,https://petitions.whitehouse.gov/responses?page=8,
signed,25000,Employ competent veterans as armed security guards for America's schools,2568,Employ competent veterans as armed security guards for America's schools,https://petitions.whitehouse.gov/petition/employ-competent-veterans-armed-security-guards-americas-schools,"2,568",View,"25,000",/petition/employ-competent-veterans-armed-security-guards-americas-schools,goal,https://petitions.whitehouse.gov/responses?page=8,Education
signed,25000,Immediately address the issue of gun control through the introduction of legislation in Congress.,197073,Immediately address the issue of gun control through the introduction of legislation in Congress.,https://petitions.whitehouse.gov/petition/immediately-address-issue-gun-control-through-introduction-legislation-congress,"197,073",View,"25,000",/petition/immediately-address-issue-gun-control-through-introduction-legislation-congress,goal,https://petitions.whitehouse.gov/responses?page=8,
signed,25000,petition the Congress and the States to REPEAL THE SECOND AMENDMENT.,3434,petition the Congress and the States to REPEAL THE SECOND AMENDMENT.,https://petitions.whitehouse.gov/petition/petition-congress-and-states-repeal-second-amendment,"3,434",View,"25,000",/petition/petition-congress-and-states-repeal-second-amendment,goal,https://petitions.whitehouse.gov/responses?page=8,
signed,25000,Keep guns in America! No weapons ban!,4334,Keep guns in America! No weapons ban!,https://petitions.whitehouse.gov/petition/keep-guns-america-no-weapons-ban,"4,334",View,"25,000",/petition/keep-guns-america-no-weapons-ban,goal,https://petitions.whitehouse.gov/responses?page=8,
signed,25000,begin a national conversation on sensible gun control.,5705,begin a national conversation on sensible gun control.,https://petitions.whitehouse.gov/petition/begin-national-conversation-sensible-gun-control,"5,705",View,"25,000",/petition/begin-national-conversation-sensible-gun-control,goal,https://petitions.whitehouse.gov/responses?page=8,
signed,25000,Ensure the 2nd Amendment cant be infringed in anyway limiting citizens ability to defend against tyrannical governments.,9572,Ensure the 2nd Amendment cant be infringed in anyway limiting citizens ability to defend against tyrannical governments.,https://petitions.whitehouse.gov/petition/ensure-2nd-amendment-cant-be-infringed-anyway-limiting-citizens-ability-defend-against,"9,572",View,"25,000",/petition/ensure-2nd-amendment-cant-be-infringed-anyway-limiting-citizens-ability-defend-against,goal,https://petitions.whitehouse.gov/responses?page=8,
signed,25000,Set a date and time to have a conversation about gun policy in the United States.,24823,Set a date and time to have a conversation about gun policy in the United States.,https://petitions.whitehouse.gov/petition/set-date-and-time-have-conversation-about-gun-policy-united-states,"24,823",View,"25,000",/petition/set-date-and-time-have-conversation-about-gun-policy-united-states,goal,https://petitions.whitehouse.gov/responses?page=8,
signed,25000,Urge Congress to advance federal legislation banning the sale of assault rifles & high capacity magazines.,25641,Urge Congress to advance federal legislation banning the sale of assault rifles & high capacity magazines.,https://petitions.whitehouse.gov/petition/urge-congress-advance-federal-legislation-banning-sale-assault-rifles-high-capacity,"25,641",View,"25,000",/petition/urge-congress-advance-federal-legislation-banning-sale-assault-rifles-high-capacity,goal,https://petitions.whitehouse.gov/responses?page=8,
signed,25000,Stronger Gun Control,23524,Stronger Gun Control,https://petitions.whitehouse.gov/petition/stronger-gun-control,"23,524",View,"25,000",/petition/stronger-gun-control,goal,https://petitions.whitehouse.gov/responses?page=8,
signed,25000,Place police officers and metal detectors in all of our schools.,667,Place police officers and metal detectors in all of our schools.,https://petitions.whitehouse.gov/petition/place-police-officers-and-metal-detectors-all-our-schools,667,View,"25,000",/petition/place-police-officers-and-metal-detectors-all-our-schools,goal,https://petitions.whitehouse.gov/responses?page=8,
signed,25000,Make Mental Health a National Emergency,10668,Make Mental Health a National Emergency,https://petitions.whitehouse.gov/petition/make-mental-health-national-emergency,"10,668",View,"25,000",/petition/make-mental-health-national-emergency,goal,https://petitions.whitehouse.gov/responses?page=8,
signed,25000,create a national commission to review our gun laws and recommend legislation to address the epidemic of gun violence.,5443,create a national commission to review our gun laws and recommend legislation to address the epidemic of gun violence.,https://petitions.whitehouse.gov/petition/create-national-commission-review-our-gun-laws-and-recommend-legislation-address-epidemic,"5,443",View,"25,000",/petition/create-national-commission-review-our-gun-laws-and-recommend-legislation-address-epidemic,goal,https://petitions.whitehouse.gov/responses?page=8,
signed,25000,"Build a federally-funded mental healthcare system in the United States that offers treatment, education, and advocacy.",12226,"Build a federally-funded mental healthcare system in the United States that offers treatment, education, and advocacy.",https://petitions.whitehouse.gov/petition/build-federally-funded-mental-healthcare-system-united-states-offers-treatment-education,"12,226",View,"25,000",/petition/build-federally-funded-mental-healthcare-system-united-states-offers-treatment-education,goal,https://petitions.whitehouse.gov/responses?page=8,Health Care
signed,25000,"Stop any legislation that will ban ""assualt weapons"", semi-automatic rifles or handguns and high capacity magazines.",31094,"Stop any legislation that will ban ""assualt weapons"", semi-automatic rifles or handguns and high capacity magazines.",https://petitions.whitehouse.gov/petition/stop-any-legislation-will-ban-assualt-weapons-semi-automatic-rifles-or-handguns-and-high,"31,094",View,"25,000",/petition/stop-any-legislation-will-ban-assualt-weapons-semi-automatic-rifles-or-handguns-and-high,goal,https://petitions.whitehouse.gov/responses?page=8,
signed,25000,"Seriously, respectfully and quickly work to end the violence committed by assault weapons.",10631,"Seriously, respectfully and quickly work to end the violence committed by assault weapons.",https://petitions.whitehouse.gov/petition/seriously-respectfully-and-quickly-work-end-violence-committed-assault-weapons,"10,631",View,"25,000",/petition/seriously-respectfully-and-quickly-work-end-violence-committed-assault-weapons,goal,https://petitions.whitehouse.gov/responses?page=8,
