signed_label,goal_number,view_description,signatures_number,nodepetition_link/_text,nodepetition_link,signatures_number/_source,view_label,goal_number/_source,nodepetition_link/_source,goal_label,pageUrl,fielditem_value
signed,100000,Oppose Trade Agreement Between Taiwan and China,118630,Oppose Trade Agreement Between Taiwan and China,https://petitions.whitehouse.gov/petition/oppose-trade-agreement-between-taiwan-and-china,"118,630",View,"100,000",/petition/oppose-trade-agreement-between-taiwan-and-china,goal,https://petitions.whitehouse.gov/responses?page=3,
signed,25000,"Prevent the FDA from regulating or banning the sale and use of electronic cigarettes, accessories and associated liquids",36009,"Prevent the FDA from regulating or banning the sale and use of electronic cigarettes, accessories and associated liquids",https://petitions.whitehouse.gov/petition/prevent-fda-regulating-or-banning-sale-and-use-electronic-cigarettes-accessories-and,"36,009",View,"25,000",/petition/prevent-fda-regulating-or-banning-sale-and-use-electronic-cigarettes-accessories-and,goal,https://petitions.whitehouse.gov/responses?page=3,Health Care
signed,100000,Deport Justin Bieber and revoke his green card.,273968,Deport Justin Bieber and revoke his green card.,https://petitions.whitehouse.gov/petition/deport-justin-bieber-and-revoke-his-green-card,"273,968",View,"100,000",/petition/deport-justin-bieber-and-revoke-his-green-card,goal,https://petitions.whitehouse.gov/responses?page=3,
signed,100000,Declare Major League Baseball Opening Day a national holiday.,102919,Declare Major League Baseball Opening Day a national holiday.,https://petitions.whitehouse.gov/petition/declare-major-league-baseball-opening-day-national-holiday,"102,919",View,"100,000",/petition/declare-major-league-baseball-opening-day-national-holiday,goal,https://petitions.whitehouse.gov/responses?page=3,
signed,100000,Impose personal sanctions on President of Ukraine Viktor Yanukovych and Cabinet of Ministers of Ukraine members,140343,Impose personal sanctions on President of Ukraine Viktor Yanukovych and Cabinet of Ministers of Ukraine members,https://petitions.whitehouse.gov/petition/impose-personal-sanctions-president-ukraine-viktor-yanukovych-and-cabinet-ministers-ukraine,"140,343",View,"100,000",/petition/impose-personal-sanctions-president-ukraine-viktor-yanukovych-and-cabinet-ministers-ukraine,goal,https://petitions.whitehouse.gov/responses?page=3,Foreign Policy
signed,100000,Petition for an offer of assistance to Ukrainian law enforcement agencies dealing with mass riots in the country.,108755,Petition for an offer of assistance to Ukrainian law enforcement agencies dealing with mass riots in the country.,https://petitions.whitehouse.gov/petition/petition-offer-assistance-ukrainian-law-enforcement-agencies-dealing-mass-riots-country-0,"108,755",View,"100,000",/petition/petition-offer-assistance-ukrainian-law-enforcement-agencies-dealing-mass-riots-country-0,goal,https://petitions.whitehouse.gov/responses?page=3,Foreign Policy
signed,100000,USE ALL LEGITIMATE CONSTITUTIONAL MEANS TO FREE YULIA TYMOSHENKO NOW. SHE IS POLITICAL PRISONER OF UKRAINIAN REGIME,137987,USE ALL LEGITIMATE CONSTITUTIONAL MEANS TO FREE YULIA TYMOSHENKO NOW. SHE IS POLITICAL PRISONER OF UKRAINIAN REGIME,https://petitions.whitehouse.gov/petition/use-all-legitimate-constitutional-means-free-yulia-tymoshenko-now-she-political-prisoner,"137,987",View,"100,000",/petition/use-all-legitimate-constitutional-means-free-yulia-tymoshenko-now-she-political-prisoner,goal,https://petitions.whitehouse.gov/responses?page=3,Foreign Policy
signed,100000,"Restore Net Neutrality By Directing the FCC to Classify Internet Providers as ""Common Carriers"".",105572,"Restore Net Neutrality By Directing the FCC to Classify Internet Providers as ""Common Carriers"".",https://petitions.whitehouse.gov/petition/restore-net-neutrality-directing-fcc-classify-internet-providers-common-carriers,"105,572",View,"100,000",/petition/restore-net-neutrality-directing-fcc-classify-internet-providers-common-carriers,goal,https://petitions.whitehouse.gov/responses?page=4,
signed,100000,authorize the FDA to grant a compassionate use exemption to Refael Elisha Cohen for Antineoplaston therapy.,102215,authorize the FDA to grant a compassionate use exemption to Refael Elisha Cohen for Antineoplaston therapy.,https://petitions.whitehouse.gov/petition/authorize-fda-grant-compassionate-use-exemption-refael-elisha-cohen-antineoplaston-therapy,"102,215",View,"100,000",/petition/authorize-fda-grant-compassionate-use-exemption-refael-elisha-cohen-antineoplaston-therapy,goal,https://petitions.whitehouse.gov/responses?page=4,Health Care
signed,25000,vigorously enforce US laws to seek the return of US citizens' properties expropriated by the Vietnamese government.,27729,vigorously enforce US laws to seek the return of US citizens' properties expropriated by the Vietnamese government.,https://petitions.whitehouse.gov/petition/vigorously-enforce-us-laws-seek-return-us-citizens-properties-expropriated-vietnamese,"27,729",View,"25,000",/petition/vigorously-enforce-us-laws-seek-return-us-citizens-properties-expropriated-vietnamese,goal,https://petitions.whitehouse.gov/responses?page=4,Foreign Policy
signed,25000,Recognize pharmacists as health care providers!,39568,Recognize pharmacists as health care providers!,https://petitions.whitehouse.gov/petition/recognize-pharmacists-health-care-providers-1,"39,568",View,"25,000",/petition/recognize-pharmacists-health-care-providers-1,goal,https://petitions.whitehouse.gov/responses?page=4,Health Care
signed,25000,Include Licensed Naturopathic Physicians as primary care providers in the Federal Healthcare Law (Obamacare).,31627,Include Licensed Naturopathic Physicians as primary care providers in the Federal Healthcare Law (Obamacare).,https://petitions.whitehouse.gov/petition/include-licensed-naturopathic-physicians-primary-care-providers-federal-healthcare-law,"31,627",View,"25,000",/petition/include-licensed-naturopathic-physicians-primary-care-providers-federal-healthcare-law,goal,https://petitions.whitehouse.gov/responses?page=4,Health Care
signed,100000,Investigate Jimmy Kimmel Kid's Table Government Shutdown Show on ABC Network,105111,Investigate Jimmy Kimmel Kid's Table Government Shutdown Show on ABC Network,https://petitions.whitehouse.gov/petition/investigate-jimmy-kimmel-kids-table-government-shutdown-show-abc-network,"105,111",View,"100,000",/petition/investigate-jimmy-kimmel-kids-table-government-shutdown-show-abc-network,goal,https://petitions.whitehouse.gov/responses?page=4,
signed,25000,Recognize Acupuncturist as Healthcare providers,31322,Recognize Acupuncturist as Healthcare providers,https://petitions.whitehouse.gov/petition/recognize-acupuncturist-healthcare-providers,"31,322",View,"25,000",/petition/recognize-acupuncturist-healthcare-providers,goal,https://petitions.whitehouse.gov/responses?page=4,Health Care
signed,100000,lift sanctions on Russian singer Grigoriy Leps.,101758,lift sanctions on Russian singer Grigoriy Leps.,https://petitions.whitehouse.gov/petition/lift-sanctions-russian-singer-grigoriy-leps,"101,758",View,"100,000",/petition/lift-sanctions-russian-singer-grigoriy-leps,goal,https://petitions.whitehouse.gov/responses?page=4,
signed,25000,Grant Temporary Protected Status to Guatemalans,29646,Grant Temporary Protected Status to Guatemalans,https://petitions.whitehouse.gov/petition/grant-temporary-protected-status-guatemalans,"29,646",View,"25,000",/petition/grant-temporary-protected-status-guatemalans,goal,https://petitions.whitehouse.gov/responses?page=4,Foreign Policy
signed,25000,Finalize Standards for GLUTEN-FREE Labeling,40639,Finalize Standards for GLUTEN-FREE Labeling,https://petitions.whitehouse.gov/petition/finalize-standards-gluten-free-labeling,"40,639",View,"25,000",/petition/finalize-standards-gluten-free-labeling,goal,https://petitions.whitehouse.gov/responses?page=4,Health Care
signed,25000,Save the Johnson Valley OHV Area. Be fiscally responsible. Stop 29 Palms Marine base expansion. Keep public lands open.,29456,Save the Johnson Valley OHV Area. Be fiscally responsible. Stop 29 Palms Marine base expansion. Keep public lands open.,https://petitions.whitehouse.gov/petition/save-johnson-valley-ohv-area-be-fiscally-responsible-stop-29-palms-marine-base-expansion,"29,456",View,"25,000",/petition/save-johnson-valley-ohv-area-be-fiscally-responsible-stop-29-palms-marine-base-expansion,goal,https://petitions.whitehouse.gov/responses?page=4,
signed,5000,End the Military’s Discrimination against Non-Religious Service Members,24395,End the Military’s Discrimination against Non-Religious Service Members,https://petitions.whitehouse.gov/petition/end-military%E2%80%99s-discrimination-against-non-religious-service-members,"24,395",View,"5,000",/petition/end-military%E2%80%99s-discrimination-against-non-religious-service-members,goal,https://petitions.whitehouse.gov/responses?page=4,
signed,25000,Light the White House gold for the month of September to honor pediatric cancer fighters and bring light to the cause.,28883,Light the White House gold for the month of September to honor pediatric cancer fighters and bring light to the cause.,https://petitions.whitehouse.gov/petition/light-white-house-gold-month-september-honor-pediatric-cancer-fighters-and-bring-light,"28,883",View,"25,000",/petition/light-white-house-gold-month-september-honor-pediatric-cancer-fighters-and-bring-light,goal,https://petitions.whitehouse.gov/responses?page=4,Health Care
signed,100000,Democracy crisis in Malaysia: foreign workers were employed for fraud voting in Malaysian General Election.,223913,Democracy crisis in Malaysia: foreign workers were employed for fraud voting in Malaysian General Election.,https://petitions.whitehouse.gov/petition/democracy-crisis-malaysia-foreign-workers-were-employed-fraud-voting-malaysian-general,"223,913",View,"100,000",/petition/democracy-crisis-malaysia-foreign-workers-were-employed-fraud-voting-malaysian-general,goal,https://petitions.whitehouse.gov/responses?page=4,Foreign Policy
signed,100000,We ask American Congress to make The Act of Alexander Dolmatov to punish all Dutch officials responsible for his death,104232,We ask American Congress to make The Act of Alexander Dolmatov to punish all Dutch officials responsible for his death,https://petitions.whitehouse.gov/petition/we-ask-american-congress-make-act-alexander-dolmatov-punish-all-dutch-officials-responsible,"104,232",View,"100,000",/petition/we-ask-american-congress-make-act-alexander-dolmatov-punish-all-dutch-officials-responsible,goal,https://petitions.whitehouse.gov/responses?page=4,Foreign Policy
signed,25000,Allow H1B approved cases to get Visa stamped in US,26513,Allow H1B approved cases to get Visa stamped in US,https://petitions.whitehouse.gov/petition/allow-h1b-approved-cases-get-visa-stamped-us,"26,513",View,"25,000",/petition/allow-h1b-approved-cases-get-visa-stamped-us,goal,https://petitions.whitehouse.gov/responses?page=4,Immigration
signed,25000,Officially recognize American Sign Language as a community language and a language of instruction in schools.,37133,Officially recognize American Sign Language as a community language and a language of instruction in schools.,https://petitions.whitehouse.gov/petition/officially-recognize-american-sign-language-community-language-and-language-instruction,"37,133",View,"25,000",/petition/officially-recognize-american-sign-language-community-language-and-language-instruction,goal,https://petitions.whitehouse.gov/responses?page=4,Education
signed,100000,Immediate Action Requested for Romeikes—Grant Permanent Legal Status to Persecuted German Homeschool Family,127258,Immediate Action Requested for Romeikes—Grant Permanent Legal Status to Persecuted German Homeschool Family,https://petitions.whitehouse.gov/petition/immediate-action-requested-romeikes%E2%80%94grant-permanent-legal-status-persecuted-german,"127,258",View,"100,000",/petition/immediate-action-requested-romeikes%E2%80%94grant-permanent-legal-status-persecuted-german,goal,https://petitions.whitehouse.gov/responses?page=4,Education
signed,25000,"Eliminate armed guards for the President, Vice-President, and their families, and establish Gun Free Zones around them",40664,"Eliminate armed guards for the President, Vice-President, and their families, and establish Gun Free Zones around them",https://petitions.whitehouse.gov/petition/eliminate-armed-guards-president-vice-president-and-their-families-and-establish-gun-free,"40,664",View,"25,000",/petition/eliminate-armed-guards-president-vice-president-and-their-families-and-establish-gun-free,goal,https://petitions.whitehouse.gov/responses?page=4,
signed,25000,"Support and fully endorse the National Rifle Association's ""National School Shield"" Program.",45625,"Support and fully endorse the National Rifle Association's ""National School Shield"" Program.",https://petitions.whitehouse.gov/petition/support-and-fully-endorse-national-rifle-associations-national-school-shield-program,"45,625",View,"25,000",/petition/support-and-fully-endorse-national-rifle-associations-national-school-shield-program,goal,https://petitions.whitehouse.gov/responses?page=4,
signed,25000,"Not INFRINGE upon 2nd Amendment rights by instituting any new form of firearms ban, legislation, or regulation.",37016,"Not INFRINGE upon 2nd Amendment rights by instituting any new form of firearms ban, legislation, or regulation.",https://petitions.whitehouse.gov/petition/not-infringe-upon-2nd-amendment-rights-instituting-any-new-form-firearms-ban-legislation-or,"37,016",View,"25,000",/petition/not-infringe-upon-2nd-amendment-rights-instituting-any-new-form-firearms-ban-legislation-or,goal,https://petitions.whitehouse.gov/responses?page=5,
signed,25000,Ban and outlaw Breed Specific Legislation (BSL) in the United States of America on a Federal level!,30189,Ban and outlaw Breed Specific Legislation (BSL) in the United States of America on a Federal level!,https://petitions.whitehouse.gov/petition/ban-and-outlaw-breed-specific-legislation-bsl-united-states-america-federal-level-0,"30,189",View,"25,000",/petition/ban-and-outlaw-breed-specific-legislation-bsl-united-states-america-federal-level-0,goal,https://petitions.whitehouse.gov/responses?page=5,
signed,25000,Vigorously support women's rights by fully engaging in efforts to ratify the 1972 Equal Rights Amendment (ERA).,33107,Vigorously support women's rights by fully engaging in efforts to ratify the 1972 Equal Rights Amendment (ERA).,https://petitions.whitehouse.gov/petition/vigorously-support-womens-rights-fully-engaging-efforts-ratify-1972-equal-rights-amendment,"33,107",View,"25,000",/petition/vigorously-support-womens-rights-fully-engaging-efforts-ratify-1972-equal-rights-amendment,goal,https://petitions.whitehouse.gov/responses?page=5,
signed,25000,Recount the election!,73550,Recount the election!,https://petitions.whitehouse.gov/petition/recount-election,"73,550",View,"25,000",/petition/recount-election,goal,https://petitions.whitehouse.gov/responses?page=5,
signed,25000,Legally recognize Westboro Baptist Church as a hate group.,367180,Legally recognize Westboro Baptist Church as a hate group.,https://petitions.whitehouse.gov/petition/legally-recognize-westboro-baptist-church-hate-group-0,"367,180",View,"25,000",/petition/legally-recognize-westboro-baptist-church-hate-group-0,goal,https://petitions.whitehouse.gov/responses?page=5,
signed,25000,Define the Westboro Baptist Church as a hate group due to promoting animosity against differing cultural demographics.,46605,Define the Westboro Baptist Church as a hate group due to promoting animosity against differing cultural demographics.,https://petitions.whitehouse.gov/petition/define-westboro-baptist-church-hate-group-due-promoting-animosity-against-differing,"46,605",View,"25,000",/petition/define-westboro-baptist-church-hate-group-due-promoting-animosity-against-differing,goal,https://petitions.whitehouse.gov/responses?page=5,
signed,25000,"Remove the Westboro Baptist Church's 501(c)(3) tax-exempt status, and make it retroactive.",67195,"Remove the Westboro Baptist Church's 501(c)(3) tax-exempt status, and make it retroactive.",https://petitions.whitehouse.gov/petition/remove-westboro-baptist-churchs-501c3-tax-exempt-status-and-make-it-retroactive,"67,195",View,"25,000",/petition/remove-westboro-baptist-churchs-501c3-tax-exempt-status-and-make-it-retroactive,goal,https://petitions.whitehouse.gov/responses?page=5,
signed,25000,Investigate the IRS Tax-Exempt Status of the Westboro Baptist Church,101110,Investigate the IRS Tax-Exempt Status of the Westboro Baptist Church,https://petitions.whitehouse.gov/petition/investigate-irs-tax-exempt-status-westboro-baptist-church,"101,110",View,"25,000",/petition/investigate-irs-tax-exempt-status-westboro-baptist-church,goal,https://petitions.whitehouse.gov/responses?page=5,
signed,25000,Revoke the tax exempt status of the Westboro Baptist Church & re-classify Westboro Baptist Church as a hate group.,92479,Revoke the tax exempt status of the Westboro Baptist Church & re-classify Westboro Baptist Church as a hate group.,https://petitions.whitehouse.gov/petition/revoke-tax-exempt-status-westboro-baptist-church-re-classify-westboro-baptist-church-hate,"92,479",View,"25,000",/petition/revoke-tax-exempt-status-westboro-baptist-church-re-classify-westboro-baptist-church-hate,goal,https://petitions.whitehouse.gov/responses?page=5,
signed,100000,Reinstate Military Tuition Assistance (TA) and block the Armed Service Branches from any further suspension of TA.,122122,Reinstate Military Tuition Assistance (TA) and block the Armed Service Branches from any further suspension of TA.,https://petitions.whitehouse.gov/petition/reinstate-military-tuition-assistance-ta-and-block-armed-service-branches-any-further,"122,122",View,"100,000",/petition/reinstate-military-tuition-assistance-ta-and-block-armed-service-branches-any-further,goal,https://petitions.whitehouse.gov/responses?page=5,Education
signed,25000,"Restrict pay for all Senators and Congress to $75,000 for a period of 3 years to repay the National deficit.",72256,"Restrict pay for all Senators and Congress to $75,000 for a period of 3 years to repay the National deficit.",https://petitions.whitehouse.gov/petition/restrict-pay-all-senators-and-congress-75000-period-3-years-repay-national-deficit,"72,256",View,"25,000",/petition/restrict-pay-all-senators-and-congress-75000-period-3-years-repay-national-deficit,goal,https://petitions.whitehouse.gov/responses?page=5,
signed,100000,Call upon the International Community to urge that a full recount of votes be done in Venezuela's presidential elections,124999,Call upon the International Community to urge that a full recount of votes be done in Venezuela's presidential elections,https://petitions.whitehouse.gov/petition/call-upon-international-community-urge-full-recount-votes-be-done-venezuelas-presidential,"124,999",View,"100,000",/petition/call-upon-international-community-urge-full-recount-votes-be-done-venezuelas-presidential,goal,https://petitions.whitehouse.gov/responses?page=5,Immigration
signed,25000,Try Senator Dianne Feinstein in a Federal Court For Treason To The Constitution,41162,Try Senator Dianne Feinstein in a Federal Court For Treason To The Constitution,https://petitions.whitehouse.gov/petition/try-senator-dianne-feinstein-federal-court-treason-constitution,"41,162",View,"25,000",/petition/try-senator-dianne-feinstein-federal-court-treason-constitution,goal,https://petitions.whitehouse.gov/responses?page=5,
signed,25000,"Impeach Sen. Diane Feinstein for violating her oath to support and defend the Constitution of the United States, re: AWB",43542,"Impeach Sen. Diane Feinstein for violating her oath to support and defend the Constitution of the United States, re: AWB",https://petitions.whitehouse.gov/petition/impeach-sen-diane-feinstein-violating-her-oath-support-and-defend-constitution-united,"43,542",View,"25,000",/petition/impeach-sen-diane-feinstein-violating-her-oath-support-and-defend-constitution-united,goal,https://petitions.whitehouse.gov/responses?page=5,
signed,25000,Repeal the Defense of Marriage Act (DOMA),52139,Repeal the Defense of Marriage Act (DOMA),https://petitions.whitehouse.gov/petition/repeal-defense-marriage-act-doma-0,"52,139",View,"25,000",/petition/repeal-defense-marriage-act-doma-0,goal,https://petitions.whitehouse.gov/responses?page=5,
signed,25000,"Make the Metric system the standard in the United States, instead of the Imperial system.",49914,"Make the Metric system the standard in the United States, instead of the Imperial system.",https://petitions.whitehouse.gov/petition/make-metric-system-standard-united-states-instead-imperial-system,"49,914",View,"25,000",/petition/make-metric-system-standard-united-states-instead-imperial-system,goal,https://petitions.whitehouse.gov/responses?page=5,Education
signed,25000,"Allow Any American To Voluntarily Opt Out Of ""ObamaCare"" [The So Called Affordable Care Act].",41386,"Allow Any American To Voluntarily Opt Out Of ""ObamaCare"" [The So Called Affordable Care Act].",https://petitions.whitehouse.gov/petition/allow-any-american-voluntarily-opt-out-obamacare-so-called-affordable-care-act,"41,386",View,"25,000",/petition/allow-any-american-voluntarily-opt-out-obamacare-so-called-affordable-care-act,goal,https://petitions.whitehouse.gov/responses?page=5,Health Care
signed,25000,Repeal Obamacare. It is killing jobs in this country. Thousands have already lost their jobs because of it.,64655,Repeal Obamacare. It is killing jobs in this country. Thousands have already lost their jobs because of it.,https://petitions.whitehouse.gov/petition/repeal-obamacare-it-killing-jobs-country-thousands-have-already-lost-their-jobs-because-it,"64,655",View,"25,000",/petition/repeal-obamacare-it-killing-jobs-country-thousands-have-already-lost-their-jobs-because-it,goal,https://petitions.whitehouse.gov/responses?page=5,Health Care
signed,100000,Stop CISPA (Cyber Intelligence Sharing and Protection Act),117576,Stop CISPA (Cyber Intelligence Sharing and Protection Act),https://petitions.whitehouse.gov/petition/stop-cispa-cyber-intelligence-sharing-and-protection-act,"117,576",View,"100,000",/petition/stop-cispa-cyber-intelligence-sharing-and-protection-act,goal,https://petitions.whitehouse.gov/responses?page=5,
signed,25000,recognize that the Islamic Government of Iran is violating the fundamental rights of Iran's Azerbaijani ethnic minority.,26780,recognize that the Islamic Government of Iran is violating the fundamental rights of Iran's Azerbaijani ethnic minority.,https://petitions.whitehouse.gov/petition/recognize-islamic-government-iran-violating-fundamental-rights-irans-azerbaijani-ethnic,"26,780",View,"25,000",/petition/recognize-islamic-government-iran-violating-fundamental-rights-irans-azerbaijani-ethnic,goal,https://petitions.whitehouse.gov/responses?page=5,Foreign Policy
signed,25000,"End to the War On Coal, end the job killing policies of the EPA and require an economic impact analysis of new policies",29323,"End to the War On Coal, end the job killing policies of the EPA and require an economic impact analysis of new policies",https://petitions.whitehouse.gov/petition/end-war-coal-end-job-killing-policies-epa-and-require-economic-impact-analysis-new-policies,"29,323",View,"25,000",/petition/end-war-coal-end-job-killing-policies-epa-and-require-economic-impact-analysis-new-policies,goal,https://petitions.whitehouse.gov/responses?page=6,
signed,5000,not veto Palestine's application to become a member of the United Nations.,12077,not veto Palestine's application to become a member of the United Nations.,https://petitions.whitehouse.gov/petition/not-veto-palestines-application-become-member-united-nations,"12,077",View,"5,000",/petition/not-veto-palestines-application-become-member-united-nations,goal,https://petitions.whitehouse.gov/responses?page=6,Foreign Policy
signed,25000,"Enforce the tax code, and strip violating Religious institutions of their tax exempt 501(c) status.",34878,"Enforce the tax code, and strip violating Religious institutions of their tax exempt 501(c) status.",https://petitions.whitehouse.gov/petition/enforce-tax-code-and-strip-violating-religious-institutions-their-tax-exempt-501c-status,"34,878",View,"25,000",/petition/enforce-tax-code-and-strip-violating-religious-institutions-their-tax-exempt-501c-status,goal,https://petitions.whitehouse.gov/responses?page=6,
signed,25000,"Toddler TORTURED and MURDERED sentence 10 years! Time Served ""77 Days for Neglect. Federal offense?",27909,"Toddler TORTURED and MURDERED sentence 10 years! Time Served ""77 Days for Neglect. Federal offense?",https://petitions.whitehouse.gov/petition/toddler-tortured-and-murdered-sentence-10-years-time-served-77-days-neglect-federal-offense,"27,909",View,"25,000",/petition/toddler-tortured-and-murdered-sentence-10-years-time-served-77-days-neglect-federal-offense,goal,https://petitions.whitehouse.gov/responses?page=6,
signed,25000,"RECOGNIZE ""SIKH GENOCIDE"" - 30,000+ KILLED IN INDIA DURING NOVEMBER 1984 - ""YES, IT IS GENOCIDE""",30517,"RECOGNIZE ""SIKH GENOCIDE"" - 30,000+ KILLED IN INDIA DURING NOVEMBER 1984 - ""YES, IT IS GENOCIDE""",https://petitions.whitehouse.gov/petition/recognize-sikh-genocide-30000-killed-india-during-november-1984-yes-it-genocide,"30,517",View,"25,000",/petition/recognize-sikh-genocide-30000-killed-india-during-november-1984-yes-it-genocide,goal,https://petitions.whitehouse.gov/responses?page=6,
signed,100000,Make Unlocking Cell Phones Legal.,114322,Make Unlocking Cell Phones Legal.,https://petitions.whitehouse.gov/petition/make-unlocking-cell-phones-legal,"114,322",View,"100,000",/petition/make-unlocking-cell-phones-legal,goal,https://petitions.whitehouse.gov/responses?page=6,
